{
  "$schema": "fnv-racesex-preview-camera-v1.schema.json",
  "schema": "opennv-fnv-racesex-preview-camera/v1",
  "engineBuild": "1.4.0.525",
  "status": "blocked-static-evidence-incomplete",
  "parityReady": false,
  "cameraContractReady": false,
  "ownedUi": {
    "logicalPath": "menus\\chargen\\race_sex_menu.xml",
    "memberSha256": "1c5e9daa5aa5eb9ae11044718874d0d27cb3665ec994487b2cc77a828805af98",
    "menuClass": "RaceSexMenu",
    "renderedMenuClass": "FORenderedMenuRaceSex",
    "faceGrab": {
      "tile": "RSM_Face_Grab",
      "id": 1,
      "x": 150,
      "y": 50,
      "width": 680,
      "height": 620,
      "tileDepth": 100,
      "aspect": {
        "numerator": 34,
        "denominator": 31
      }
    },
    "onMenuOpenTraits": {
      "fullIn": ["user10", "user11", "user12"],
      "fullOut": ["user13", "user14", "user15"],
      "startingZoomPercent": "user16",
      "runtimeValuesStatus": "unresolved"
    }
  },
  "camera": {
    "projection": {
      "status": "unresolved",
      "value": null,
      "blocker": "Static retail code pages for the rendered RaceSex route are encrypted at rest."
    },
    "target": {
      "status": "unresolved",
      "value": null,
      "blocker": "Owned XML names no head, bone, node, or local target offset."
    },
    "distance": {
      "status": "unresolved",
      "value": null,
      "blocker": "Owned XML reserves Full-in, Full-out, and zoom traits but defines neither values nor units."
    },
    "frustum": {
      "status": "unresolved",
      "value": null,
      "blocker": "No static decoded camera setup establishes near, far, or projection planes."
    },
    "aspectBehavior": {
      "status": "unresolved",
      "value": null,
      "blocker": "The FaceGrab UI aspect is known, but its relationship to the render projection is not."
    }
  },
  "evidence": {
    "classification": "private-clean-room-static-analysis",
    "retailProcessLaunched": false,
    "liveAttachUsed": false,
    "staticClassRoute": "confirmed",
    "staticCodeBody": "unavailable-encrypted-at-rest"
  }
}
